ipo_chittorgarh_multi,IPO_Key_Info
,
Company_Name,Company_Name
Arisinfra Solutions Ltd. IPO (Arisinfra Solutions IPO) Detail,All Time Plastics
Oswal Pumps Ltd. IPO (Oswal Pumps IPO) Detail,BlueStone Jewellery
Prostarm Info Systems Ltd. IPO (Prostarm Info Systems IPO) Detail,Indiqube Spaces
Schloss Bangalore Ltd. IPO (Schloss Bangalore IPO) Detail,SW Cement
Aegis Vopak Terminals Ltd. IPO (Aegis Vopak Terminals IPO) Detail,Ellenbarrie Industrial Gases
Belrise Industries Ltd. IPO (Belrise Industries IPO) Detail,Entero Healthcare Solutions
Ather Energy Ltd. IPO (Ather Energy IPO) Detail,Jana Small Finance Bank
Quality Power Electrical Equipments Ltd. IPO (Quality Power Electrical IPO) Detail,Capital Small Finance Bank
Hexaware Technologies Ltd. IPO (Hexaware Technologies IPO) Detail,Apeejay Surrendra Park Hotels
Ajax Engineering Ltd. IPO (Ajax Engineering IPO) Detail,Services
Dr.Agarwal's Health Care Ltd. IPO (Dr.Agarwal's Health Care IPO) Detail,EPACK Durable
Denta Water & Infra Solutions Ltd. IPO (Denta Water IPO) Detail,Nova AgriTech
Stallion India Fluorochemicals Ltd. IPO (Stallion India Fluorochemicals IPO) Detail,Jyoti CNC Automation
Laxmi Dental Ltd. IPO (Laxmi Dental IPO) Detail,Azad Engineering
Standard Glass Lining Technology Ltd. IPO (Standard Glass Lining IPO) Detail,Muthoot Microfin
Quadrant Future Tek Ltd. IPO (Quadrant Future Tek IPO) Detail,Globe Civil Projects
Indo Farm Equipment Ltd. IPO (Indo Farm Equipment IPO) Detail,Innova Captab
Unimech Aerospace & Manufacturing Ltd. IPO (Unimech Aerospace IPO) Detail,Happy Forgings
Senores Pharmaceuticals Ltd. IPO (Senores Pharmaceuticals IPO) Detail,Credo Brands Marketing
DAM Capital Advisors Ltd. IPO (DAM Capital Advisors IPO) Detail,RBZ Jewellers
DAM Capital Advisors Ltd. IPO (DAM Capital Advisors IPO) Detail,Suraj Estate Developers
Carraro India Ltd. IPO (Carraro India IPO) Detail,Motisons Jewellers
Concord Enviro Systems Ltd. IPO (Concord Enviro Systems IPO) Detail,DOMS Industries
Transrail Lighting Ltd. IPO (Transrail Lighting IPO) Detail,Inox India
Ventive Hospitality Ltd. IPO (Ventive Hospitality IPO) Detail,India Shelter Finance
Sanathan Textiles Ltd. IPO (Sanathan Textiles IPO) Detail,Tata Technologies
Mamata Machinery Ltd. IPO (Mamata Machinery IPO) Detail,Arisinfra Solutions
International Gemmological Institute (India) Ltd. IPO (International Gemmological IPO) Detail,Gandhar Oil Refinery
Inventurus Knowledge Solutions Ltd. IPO (Inventurus Knowledge IPO) Detail,IREDA
One Mobikwik Systems Ltd. IPO (One Mobikwik Systems IPO) Detail,Flair Writing Industries
Sai Life Sciences Ltd. IPO (Sai Life Sciences IPO) Detail,Fedbank Financial
Vishal Mega Mart Ltd. IPO (Vishal Mega Mart IPO) Detail,Protean eGov Technologies
Suraksha Diagnostic Ltd. IPO (Suraksha Diagnostic IPO) Detail,ASK Automotive
Enviro Infra Engineers Ltd. IPO (Enviro Infra Engineers IPO) Detail,ESAF Small Finance Bank
NTPC Green Energy Ltd. IPO (NTPC Green Energy IPO) Detail,Honasa Consumer
Zinka Logistics Solutions Ltd. IPO (Zinka Logistics Solutions IPO) Detail,Cello World
Niva Bupa Health Insurance Co.Ltd. IPO (Niva Bupa Health Insurance IPO) Detail,Plaza Wires
ACME Solar Holdings Ltd. IPO (ACME Solar Holdings IPO) Detail,Oswal Pumps
ACME Solar Holdings Ltd. IPO (ACME Solar Holdings IPO) Detail,Blue Jet Healthcare
Sagility India Ltd. IPO (Sagility India IPO) Detail,IRM Energy
Swiggy Ltd. IPO (Swiggy IPO) Detail,Updater
Deepak Builders & Engineers India Ltd. IPO (Deepak Builders IPO) Detail,Jewellers
Afcons Infrastructure Ltd. IPO (Afcons Infrastructure IPO) Detail,JSW Infrastructure
Godavari Biorefineries Ltd. IPO (Godavari Biorefineries IPO) Detail,Signatureglobal
Waaree Energies Ltd. IPO (Waaree Energies IPO) Detail,
Hyundai Motor India Ltd. IPO (Hyundai Motor IPO) Detail,Yatra Online
Bajaj Housing Finance Ltd. IPO (Bajaj Housing Finance IPO) Detail,SAMHI Hotels
Manba Finance Ltd. IPO (Manba Finance IPO) Detail,Zaggle Prepaid Ocean
Western Carriers (India) Ltd. IPO (Western Carriers IPO) Detail,Prostarm Info Systems
Arkade Developers Ltd. IPO (Arkade Developers IPO) Detail,R R Kabel
Kross Ltd. IPO (Kross IPO) Detail,EMS
Gala Precision Engineering Ltd. IPO (Gala Precision Engineering IPO) Detail,Jupiter Life Line Hospitals
Orient Technologies Ltd. IPO (Orient Technologies IPO) Detail,Ratnaveer Precision Engineering
Shree Tirupati Balajee FIBC Ltd. IPO (Shree Tirupati Balajee FIBC IPO) Detail,Rishabh Instruments
ECOS (India) Mobility & Hospitality Ltd. IPO (ECOS Mobility IPO) Detail,Punglia
Premier Energies Ltd. IPO (Premier Energies IPO) Detail,Aeroflex Industries
Brainbees Solutions Ltd. IPO (Brainbees Solutions IPO) Detail,Concord Biotech
Pyramid Technoplast Ltd. IPO (Pyramid Technoplast IPO) Detail,TVS Supply Chain Solutions
Unicommerce eSolutions Ltd. IPO (Unicommerce eSolutions IPO) Detail,SBFC Finance
Ceigall India Ltd. IPO (Ceigall India IPO) Detail,Schloss Bangalore
Ola Electric Mobility Ltd. IPO (Ola Electric Mobility IPO) Detail,Yatharth Hospital
Akums Drugs & Pharmaceuticals Ltd. IPO (Akums Drugs IPO) Detail,Netweb Technologies
Sanstar Ltd. IPO (Sanstar IPO) Detail,Utkarsh Small Finance Bank
Emcure Pharmaceuticals Ltd. IPO (Emcure Pharmaceuticals IPO) Detail,Senco Gold
Bansal Wire Industries Ltd. IPO (Bansal Wire Industries IPO) Detail,Cyient DLM
Akme Fintrade (India) Ltd. IPO (Akme Fintrade IPO) Detail,ideaForge Technology
Vraj Iron & Steel Ltd. IPO (Vraj Iron IPO) Detail,HMA Agro Industries
Stanley Lifestyles Ltd. IPO (Stanley Lifestyles IPO) Detail,IKIO Lighting
DEE Development Engineers Ltd. IPO (DEE Development Engineers IPO) Detail,Mankind Pharma
Le Travenues Technology Ltd. IPO (Le Travenues Technology IPO) Detail,De Neers Tools
Kronox Lab Sciences Ltd. IPO (Kronox Lab Sciences IPO) Detail,Aegis Vopak Terminals
Awfis Space Solutions Ltd. IPO (Awfis Space Solutions IPO) Detail,Avalon Technologies
Go Digit General Insurance Ltd. IPO (Go Digit General Insurance IPO) Detail,Global Surfaces
TBO Tek Ltd. IPO (TBO Tek IPO) Detail,Udayshivakumar Infra
Aadhar Housing Finance Ltd. IPO (Aadhar Housing Finance IPO) Detail,Divgi TorqTransfer Systems
Indegene Ltd. IPO (Indegene IPO) Detail,Sah Polymers
JNK India Ltd. IPO (JNK India IPO) Detail,Radiant Cash Management
Bharti Hexacom Ltd. IPO (Bharti Hexacom IPO) Detail,KFin Technologies
Krystal Integrated Services Ltd. IPO (Krystal Integrated IPO) Detail,Elin Electronics
Popular Vehicles & Services Ltd. IPO (Popular Vehicles IPO) Detail,Abans Holdings
Gopal Snacks Ltd. IPO (Gopal Snacks IPO) Detail,Landmark Cars
J.G.Chemicals Ltd. IPO (J.G.Chemicals IPO) Detail,Belrise Industries
R K SWAMY Ltd. IPO (R K SWAMY IPO) Detail,Sula Vineyards
Mukka Proteins Ltd. IPO (Mukka Proteins IPO) Detail,Dharmaj Crop Guard
GPT Healthcare Ltd. IPO (GPT Healthcare IPO) Detail,Uniparts India
Platinum Industries Ltd. IPO (Platinum Industries IPO) Detail,Kaynes Technology
Exicom Tele-Systems Ltd. IPO (Exicom Tele-Systems IPO) Detail,Keystone Realtors
Juniper Hotels Ltd. IPO (Juniper Hotels IPO) Detail,Inox Green Energy
Vibhor Steel Tubes Ltd. IPO (Vibhor Steel Tubes IPO) Detail,Star Business Finance
Rashi Peripherals Ltd. IPO (Rashi Peripherals IPO) Detail,Archean Chemical Industries
Entero Healthcare Solutions Ltd. IPO (Entero Healthcare Solutions IPO) Detail,Bikaji Foods International
Jana Small Finance Bank Ltd. IPO (Jana Small Finance Bank IPO) Detail,Global Health
Capital Small Finance Bank Ltd. IPO (Capital Small Finance Bank IPO) Detail,Ather Energy
Apeejay Surrendra Park Hotels Ltd. IPO (Apeejay Surrendra Park Hotels IPO) Detail,Fusion Micro Finance
BLS E-Services Ltd. IPO (BLS E-Services IPO) Detail,DCX Systems
EPACK Durable Ltd. IPO (EPACK Durable IPO) Detail,Integrated Personnel Services
Nova AgriTech Ltd. IPO (Nova AgriTech IPO) Detail,Tracxn Technologies
Jyoti CNC Automation Ltd. IPO (Jyoti CNC Automation IPO) Detail,Electronics Mart
Azad Engineering Ltd. IPO (Azad Engineering IPO) Detail,Harsha Engineers
Muthoot Microfin Ltd. IPO (Muthoot Microfin IPO) Detail,Tamilnad Mercantile Bank
Innova Captab Ltd. IPO (Innova Captab IPO) Detail,Syrma SGS Technology
Happy Forgings Ltd. IPO (Happy Forgings IPO) Detail,Dreamfolks
Credo Brands Marketing Ltd. IPO (Credo Brands Marketing IPO) Detail,Campus Activewear
RBZ Jewellers Ltd. IPO (RBZ Jewellers IPO) Detail,Quality Power Electrical
Suraj Estate Developers Ltd. IPO (Suraj Estate Developers IPO) Detail,Aether Industries
Motisons Jewellers Ltd. IPO (Motisons Jewellers IPO) Detail,Ethos
DOMS Industries Ltd. IPO (DOMS Industries IPO) Detail,eMudhra
Inox India Ltd. IPO (Inox India IPO) Detail,Paradeep Phosphates
India Shelter Finance Corp.Ltd. IPO (India Shelter Finance IPO) Detail,Venus Pipes
Tata Technologies Ltd. IPO (Tata Technologies IPO) Detail,Delhivery
Gandhar Oil Refinery (India) Ltd. IPO (Gandhar Oil Refinery IPO) Detail,Prudent Corporate Advisory
Indian Renewable Energy Development Agency Ltd. IPO (IREDA IPO) Detail,LIC
Flair Writing Industries Ltd. IPO (Flair Writing Industries IPO) Detail,s Medicare
Fedbank Financial Services Ltd. IPO (Fedbank Financial IPO) Detail,Fone4 Communications
Protean eGov Technologies Ltd. IPO (Protean eGov Technologies IPO) Detail,Laxmi India Finance
ASK Automotive Ltd. IPO (ASK Automotive IPO) Detail,Hexaware Technologies
ESAF Small Finance Bank Ltd. IPO (ESAF Small Finance Bank IPO) Detail,Hariom Pipe Industries
Honasa Consumer Ltd. IPO (Honasa Consumer IPO) Detail,Uma Exports
Cello World Ltd. IPO (Cello World IPO) Detail,Veranda Learning Solutions
Plaza Wires Ltd. IPO (Plaza Wires IPO) Detail,
Blue Jet Healthcare Ltd. IPO (Blue Jet Healthcare IPO) Detail,Ekennis Software
IRM Energy Ltd. IPO (IRM Energy IPO) Detail,Vedant Fashions
Updater Services Ltd. IPO (Updater IPO) Detail,Adani Wilmar
Manoj Vaibhav Gems 'N' Jewellers Ltd. IPO (Manoj Vaibhav Gems 'N' Jewellers IPO) Detail,AGS Transact Technologies
JSW Infrastructure Ltd. IPO (JSW Infrastructure IPO) Detail,Safa Systems
Signatureglobal (India) Ltd. IPO (Signatureglobal IPO) Detail,AB Cotspin
Sai Silks (Kalamandir) Ltd. IPO (Sai Silks (Kalamandir) IPO) Detail,Ajax Engineering
Yatra Online Ltd. IPO (Yatra Online IPO) Detail,Timescan Logistics
SAMHI Hotels Ltd. IPO (SAMHI Hotels IPO) Detail,CMS Info Systems
Zaggle Prepaid Ocean Services Ltd. IPO (Zaggle Prepaid Ocean IPO) Detail,Supriya Lifescience
R R Kabel Ltd. IPO (R R Kabel IPO) Detail,Medplus Health
EMS Ltd. IPO (EMS IPO) Detail,HP Adhesives
Jupiter Life Line Hospitals Ltd. IPO (Jupiter Life Line Hospitals IPO) Detail,Data Patterns
Ratnaveer Precision Engineering Ltd. IPO (Ratnaveer Precision Engineering IPO) Detail,Vivo Collaboration Solutions
Rishabh Instruments Ltd. IPO (Rishabh Instruments IPO) Detail,Metro Brands
Vishnu Prakash R.Punglia Ltd. IPO (Vishnu Prakash R.Punglia IPO) Detail,Nupur Recyclers
Aeroflex Industries Ltd. IPO (Aeroflex Industries IPO) Detail,Info systems
Concord Biotech Ltd. IPO (Concord Biotech IPO) Detail,s Health Care
TVS Supply Chain Solutions Ltd. IPO (TVS Supply Chain Solutions IPO) Detail,Shriram Properties
SBFC Finance Ltd. IPO (SBFC Finance IPO) Detail,Rategain Travel Technologies
Yatharth Hospital & Trauma Care Services Ltd. IPO (Yatharth Hospital IPO) Detail,Anand Rathi Wealth
Netweb Technologies India Ltd. IPO (Netweb Technologies IPO) Detail,Tega Industries
Utkarsh Small Finance Bank Ltd. IPO (Utkarsh Small Finance Bank IPO) Detail,Star Health
Senco Gold Ltd. IPO (Senco Gold IPO) Detail,Go Fashion
Cyient DLM Ltd. IPO (Cyient DLM IPO) Detail,Tarsons Products
ideaForge Technology Ltd. IPO (ideaForge Technology IPO) Detail,Latent View Analytics
HMA Agro Industries Ltd. IPO (HMA Agro Industries IPO) Detail,Sapphire Foods
IKIO Lighting Ltd. IPO (IKIO Lighting IPO) Detail,Paytm
Mankind Pharma Ltd. IPO (Mankind Pharma IPO) Detail,Denta Water
De Neers Tools Ltd. IPO (De Neers Tools IPO) Detail,PB Fintech
Avalon Technologies Ltd. IPO (Avalon Technologies IPO) Detail,Fino Payments Bank
Udayshivakumar Infra Ltd. IPO (Udayshivakumar Infra IPO) Detail,Commerce Ventures
Divgi TorqTransfer Systems Ltd. IPO (Divgi TorqTransfer Systems IPO) Detail,Sigachi Industries
Sah Polymers Ltd. IPO (Sah Polymers IPO) Detail,Enterprises
Radiant Cash Management Services Ltd. IPO (Radiant Cash Management IPO) Detail,Sansera Engineering
KFin Technologies Ltd. IPO (KFin Technologies IPO) Detail,Aditya Birla Sun Life AMC
Elin Electronics Ltd. IPO (Elin Electronics IPO) Detail,Paras Defence
Abans Holdings Ltd. IPO (Abans Holdings IPO) Detail,Quadpro ITeS
Landmark Cars Ltd. IPO (Landmark Cars IPO) Detail,Vijaya Diagnostic Centre
Sula Vineyards Ltd. IPO (Sula Vineyards IPO) Detail,Stallion India Fluorochemicals
Dharmaj Crop Guard Ltd. IPO (Dharmaj Crop Guard IPO) Detail,Ami Organics
Uniparts India Ltd. IPO (Uniparts India IPO) Detail,Aptus Value Housing Finance
Kaynes Technology India Ltd. IPO (Kaynes Technology IPO) Detail,Nuvoco Vistas
Keystone Realtors Ltd. IPO (Keystone Realtors IPO) Detail,Chemplast Sanmar
Inox Green Energy Services Ltd. IPO (Inox Green Energy IPO) Detail,CarTrade Tech
Five-Star Business Finance Ltd. IPO (Five-Star Business Finance IPO) Detail,Krsnaa Diagnostics
Archean Chemical Industries Ltd. IPO (Archean Chemical Industries IPO) Detail,Exxaro Tiles
Bikaji Foods International Ltd. IPO (Bikaji Foods International IPO) Detail,Windlas Biotech
Global Health Ltd. IPO (Global Health IPO) Detail,Devyani International
Fusion Micro Finance Ltd. IPO (Fusion Micro Finance IPO) Detail,Rolex Rings
DCX Systems Ltd. IPO (DCX Systems IPO) Detail,Laxmi Dental
Integrated Personnel Services Ltd. IPO (Integrated Personnel Services IPO) Detail,Glenmark Life Sciences
Tracxn Technologies Ltd. IPO (Tracxn Technologies IPO) Detail,Tatva Chintan Pharma Chem
Electronics Mart India Ltd. IPO (Electronics Mart IPO) Detail,Zomato
Harsha Engineers International Ltd. IPO (Harsha Engineers IPO) Detail,G R Infraprojects
Tamilnad Mercantile Bank Ltd. IPO (Tamilnad Mercantile Bank IPO) Detail,Clean Science
Syrma SGS Technology Ltd. IPO (Syrma SGS Technology IPO) Detail,India Pesticides
Dreamfolks Services Ltd. IPO (Dreamfolks IPO) Detail,KIMS
Campus Activewear Ltd. IPO (Campus Activewear IPO) Detail,Dodla Dairy
Aether Industries Ltd. IPO (Aether Industries IPO) Detail,Sona BLW Precision Forgings
Ethos Ltd. IPO (Ethos IPO) Detail,Shyam Metalics
eMudhra Ltd. IPO (eMudhra IPO) Detail,Standard Glass Lining
Paradeep Phosphates Ltd. IPO (Paradeep Phosphates IPO) Detail,Times Green Energy
Venus Pipes & Tubes Ltd. IPO (Venus Pipes IPO) Detail,Macrotech Developers
Delhivery Ltd. IPO (Delhivery IPO) Detail,Macrotech Developers
Prudent Corporate Advisory Services Ltd. IPO (Prudent Corporate Advisory IPO) Detail,Marc India
Life Insurance Corp.of India IPO (LIC IPO) Detail,Jetmall Spices
Rainbow Children's Medicare Ltd. IPO (Rainbow Children's Medicare IPO) Detail,Kuberan Global Edu
Fone4 Communications (India) Ltd. IPO (Fone4 Communications IPO) Detail,Nation Hospitality
Hariom Pipe Industries Ltd. IPO (Hariom Pipe Industries IPO) Detail,EKI Energy
Uma Exports Ltd. IPO (Uma Exports IPO) Detail,Nazara Technologies
Veranda Learning Solutions Ltd. IPO (Veranda Learning Solutions IPO) Detail,Siddhika Coatings
Ruchi Soya Industries Ltd. FPO (Ruchi Soya Industries FPO) Detail,Quadrant Future Tek
Ekennis Software Service Ltd. IPO (Ekennis Software IPO) Detail,Laxmi Organic Industries
Vedant Fashions Ltd. IPO (Vedant Fashions IPO) Detail,Suryoday Small Finance Bank
Adani Wilmar Ltd. IPO (Adani Wilmar IPO) Detail,Kalyan Jewellers
AGS Transact Technologies Ltd. IPO (AGS Transact Technologies IPO) Detail,Anupam Rasayan
Safa Systems & Technologies Ltd. IPO (Safa Systems IPO) Detail,Craftsman Automation
AB Cotspin India Ltd. IPO (AB Cotspin IPO) Detail,Easy Trip Planners
Timescan Logistics (India) Ltd. IPO (Timescan Logistics IPO) Detail,RailTel
CMS Info Systems Ltd. IPO (CMS Info Systems IPO) Detail,MTAR Technologies
Supriya Lifescience Ltd. IPO (Supriya Lifescience IPO) Detail,Nureca
Medplus Health Services Ltd. IPO (Medplus Health IPO) Detail,Party Cruisers
HP Adhesives Ltd. IPO (HP Adhesives IPO) Detail,Indo Farm Equipment
Data Patterns (India) Ltd. IPO (Data Patterns IPO) Detail,Stove Kraft
Vivo Collaboration Solutions Ltd. IPO (Vivo Collaboration Solutions IPO) Detail,Home First Finance
Metro Brands Ltd. IPO (Metro Brands IPO) Detail,Indigo Paints
Clara Industries Ltd. IPO (Clara Industries IPO) Detail,IRFC
Nupur Recyclers Ltd. IPO (Nupur Recyclers IPO) Detail,Antony Waste Handling Cell
C.E.Info systems Ltd. IPO (C.E.Info systems IPO) Detail,Bectors Food Specialities
Shriram Properties Ltd. IPO (Shriram Properties IPO) Detail,Burger King
Rategain Travel Technologies Ltd. IPO (Rategain Travel Technologies IPO) Detail,Net Pix Shorts Digital Media
Anand Rathi Wealth Ltd. IPO (Anand Rathi Wealth IPO) Detail,
Tega Industries Ltd. IPO (Tega Industries IPO) Detail,Gland Pharma
Star Health & Allied Insurance Co.Ltd. IPO (Star Health IPO) Detail,Unimech Aerospace
Go Fashion (India) Ltd. IPO (Go Fashion IPO) Detail,Shine Fashions
Tarsons Products Ltd. IPO (Tarsons Products IPO) Detail,Equitas Small Finance Bank
Latent View Analytics Ltd. IPO (Latent View Analytics IPO) Detail,UTI AMC
Sapphire Foods India Ltd. IPO (Sapphire Foods IPO) Detail,Likhitha Infrastructure
One 97 Communications Ltd. IPO (Paytm IPO) Detail,Mazagon Dock Shipbuilders
PB Fintech Ltd. IPO (PB Fintech IPO) Detail,AAA Technologies
Fino Payments Bank Ltd. IPO (Fino Payments Bank IPO) Detail,Angel Broking
FSN E-Commerce Ventures Ltd. IPO (FSN E-Commerce Ventures IPO) Detail,CAMS
Sigachi Industries Ltd. IPO (Sigachi Industries IPO) Detail,Chemcon Speciality Chemicals
S.J.S.Enterprises Ltd. IPO (S.J.S.Enterprises IPO) Detail,Route Mobile
Sansera Engineering Ltd. IPO (Sansera Engineering IPO) Detail,Anthem Biosciences
Aditya Birla Sun Life AMC Ltd. IPO (Aditya Birla Sun Life AMC IPO) Detail,Senores Pharmaceuticals
Paras Defence & Space Technologies Ltd. IPO (Paras Defence IPO) Detail,Happiest Minds Technologies
Quadpro ITeS Ltd. IPO (Quadpro ITeS IPO) Detail,com
Vijaya Diagnostic Centre Ltd. IPO (Vijaya Diagnostic Centre IPO) Detail,Rossari Biotech
Ami Organics Ltd. IPO (Ami Organics IPO) Detail,Ksolves India
Aptus Value Housing Finance India Ltd. IPO (Aptus Value Housing Finance IPO) Detail,SBI Cards
,RO Jewels
Chemplast Sanmar Ltd. IPO (Chemplast Sanmar IPO) Detail,DAM Capital Advisors
CarTrade Tech Ltd. IPO (CarTrade Tech IPO) Detail,Carraro India
Krsnaa Diagnostics Ltd. IPO (Krsnaa Diagnostics IPO) Detail,Concord Enviro Systems
Exxaro Tiles Ltd. IPO (Exxaro Tiles IPO) Detail,Transrail Lighting
Windlas Biotech Ltd. IPO (Windlas Biotech IPO) Detail,Ventive Hospitality
Devyani International Ltd. IPO (Devyani International IPO) Detail,Sanathan Textiles
Rolex Rings Ltd. IPO (Rolex Rings IPO) Detail,Mamata Machinery
Glenmark Life Sciences Ltd. IPO (Glenmark Life Sciences IPO) Detail,International Gemmological
Tatva Chintan Pharma Chem Ltd. IPO (Tatva Chintan Pharma Chem IPO) Detail,Inventurus Knowledge
Zomato Ltd. IPO (Zomato IPO) Detail,Smartworks Coworking Spaces
G R Infraprojects Ltd. IPO (G R Infraprojects IPO) Detail,One Mobikwik Systems
Clean Science & Technology Ltd. IPO (Clean Science IPO) Detail,Sai Life Sciences
India Pesticides Ltd. IPO (India Pesticides IPO) Detail,Vishal Mega Mart
Krishna Institute of Medical Sciences Ltd. IPO (KIMS IPO) Detail,Suraksha Diagnostic
Dodla Dairy Ltd. IPO (Dodla Dairy IPO) Detail,Enviro Infra Engineers
Sona BLW Precision Forgings Ltd. IPO (Sona BLW Precision Forgings IPO) Detail,NTPC Green Energy
Shyam Metalics & Energy Ltd. IPO (Shyam Metalics IPO) Detail,Zinka Logistics Solutions
Times Green Energy (India) Ltd. IPO (Times Green Energy IPO) Detail,Niva Bupa Health Insurance
Macrotech Developers Ltd. IPO (Macrotech Developers IPO) Detail,ACME Solar Holdings
V-Marc India Ltd. IPO (V-Marc India IPO) Detail,Sagility India
Jetmall Spices & Masala Ltd. IPO (Jetmall Spices IPO) Detail,Travel Food Services
Kuberan Global Edu Solutions Ltd. IPO (Kuberan Global Edu IPO) Detail,Swiggy
Barbeque-Nation Hospitality Ltd. IPO (Barbeque-Nation Hospitality IPO) Detail,Deepak Builders
EKI Energy Services Ltd. IPO (EKI Energy IPO) Detail,Afcons Infrastructure
Nazara Technologies Ltd. IPO (Nazara Technologies IPO) Detail,Godavari Biorefineries
Siddhika Coatings Ltd. IPO (Siddhika Coatings IPO) Detail,Waaree Energies
Laxmi Organic Industries Ltd. IPO (Laxmi Organic Industries IPO) Detail,Hyundai Motor
Suryoday Small Finance Bank Ltd. IPO (Suryoday Small Finance Bank IPO) Detail,Bajaj Housing Finance
Kalyan Jewellers India Ltd. IPO (Kalyan Jewellers IPO) Detail,Manba Finance
Anupam Rasayan India Ltd. IPO (Anupam Rasayan IPO) Detail,Western Carriers
Craftsman Automation Ltd. IPO (Craftsman Automation IPO) Detail,Arkade Developers
Easy Trip Planners Ltd. IPO (Easy Trip Planners IPO) Detail,Crizac
RailTel Corp.of India Ltd. IPO (RailTel IPO) Detail,Kross
MTAR Technologies Ltd. IPO (MTAR Technologies IPO) Detail,Gala Precision Engineering
Nureca Ltd. IPO (Nureca IPO) Detail,Orient Technologies
Party Cruisers Ltd. IPO (Party Cruisers IPO) Detail,Shree Tirupati Balajee FIBC
Stove Kraft Ltd. IPO (Stove Kraft IPO) Detail,ECOS Mobility
Home First Finance Co.India Ltd. IPO (Home First Finance IPO) Detail,Premier Energies
Indigo Paints Ltd. IPO (Indigo Paints IPO) Detail,Brainbees Solutions
Indian Railway Finance Corp.Ltd. IPO (IRFC IPO) Detail,Pyramid Technoplast
Antony Waste Handling Cell Ltd. IPO (Antony Waste Handling Cell IPO) Detail,Unicommerce eSolutions
Mrs.Bectors Food Specialities Ltd. IPO (Mrs.Bectors Food Specialities IPO) Detail,Ceigall India
Burger King India Ltd. IPO (Burger King IPO) Detail,Sambhv Steel Tubes
Net Pix Shorts Digital Media Ltd. IPO (Net Pix Shorts Digital Media IPO) Detail,Ola Electric Mobility
Gland Pharma Ltd. IPO (Gland Pharma IPO) Detail,Akums Drugs
Shine Fashions (India) Ltd. IPO (Shine Fashions IPO) Detail,Sanstar
Equitas Small Finance Bank Ltd. IPO (Equitas Small Finance Bank IPO) Detail,Emcure Pharmaceuticals
UTI Asset Management Co.Ltd. IPO (UTI AMC IPO) Detail,Bansal Wire Industries
Likhitha Infrastructure Ltd. IPO (Likhitha Infrastructure IPO) Detail,Akme Fintrade
Mazagon Dock Shipbuilders Ltd. IPO (Mazagon Dock Shipbuilders IPO) Detail,Vraj Iron
AAA Technologies Ltd. IPO (AAA Technologies IPO) Detail,Stanley Lifestyles
Angel Broking Ltd. IPO (Angel Broking IPO) Detail,DEE Development Engineers
Computer Age Management Services Ltd. IPO (CAMS IPO) Detail,Le Travenues Technology
Chemcon Speciality Chemicals Ltd. IPO (Chemcon Speciality Chemicals IPO) Detail,Kalpataru
Route Mobile Ltd. IPO (Route Mobile IPO) Detail,Kronox Lab Sciences
Happiest Minds Technologies Ltd. IPO (Happiest Minds Technologies IPO) Detail,Awfis Space Solutions
Trekkingtoes.com Ltd. IPO (Trekkingtoes.com IPO) Detail,Go Digit General Insurance
Rossari Biotech Ltd. IPO (Rossari Biotech IPO) Detail,TBO Tek
Ksolves India Ltd. IPO (Ksolves India IPO) Detail,Aadhar Housing Finance
SBI Cards & Payment Services Ltd. IPO (SBI Cards IPO) Detail,Indegene
RO Jewels Ltd. IPO (RO Jewels IPO) Detail,JNK India
,Bharti Hexacom
,Krystal Integrated
,Popular Vehicles
,HDB Financial
,Gopal Snacks
,Chemicals
,R K SWAMY
,Mukka Proteins
,GPT Healthcare
,Platinum Industries
,Systems
,Juniper Hotels
,Vibhor Steel Tubes
,Rashi Peripherals
,Aditya Infotech
,Regaal Resources
